id,title,description
no-alert,No Alert Required,No weather alert conditions detected. All values within normal range.
high_wind_alert,High Wind Warning,Strong winds have been detected. Please secure outdoor objects and stay indoors.
heavy_rain_alert,Heavy Rain Alert,Significant precipitation is expected. Please take necessary precautions.
storm_alert,Storm Alert,Storm conditions detected. Strong winds and heavy precipitation. Stay indoors and avoid travel.
coastal_warning,Coastal Warning,Dangerous weather conditions for coastal areas. Strong winds and significant waves expected.
